<?xml version="1.0" encoding="UTF-8"?>
<enderio:recipes xmlns:enderio="http://enderio.com/recipes" xmlns:xsi="http://www.w3.org/2001/XMLSchema-instance" xsi:schemaLocation="http://enderio.com/recipes recipes.xsd ">

<!-- 

These are the build-in recipes. You cannot change this file, it is a
reference for you only and will be generated every time the game starts.

To make changes to the recipes, copy the recipes you want to change to
the matching _user.xml. To disabled a recipe, add an attribute "disabled"
and set it to true, e.g.: <recipe name="Gear" disabled="true" />

Item specifications can reference an alias, an ore dictionary name, a
block or an item. You can force the type by prefixing the value with
"oredict:", "block:" or "item:". Recipes that have items that cannot be
found in-game are either skipped or an error, depending on their "required"
attribute.

More information on the syntax can be found in the recipes.xsd file. An
XML editor will display that as tooltips when editing this file.

 -->

  <recipe name="Painted Pressure Plate, Dark Steel" required="true">
    <crafting>
      <grid size="2x1">
        <item name="DARK_STEEL" /><item name="DARK_STEEL" />
      </grid>
      <output name="PPP_DARK_STEEL" />
    </crafting>
  </recipe>

  <recipe name="Painted Pressure Plate, Soularium" required="true">
    <crafting>
      <grid size="2x1">
        <item name="SOULARIUM" /><item name="SOULARIUM" />
      </grid>
      <output name="PPP_SOULARIUM" />
    </crafting>
  </recipe>

  <recipe name="Painted Pressure Plate, Wood, Silent" required="true">
    <crafting>
      <grid size="1x2">
        <item name="minecraft:wooden_pressure_plate" />
        <item name="minecraft:wool" />
      </grid>
      <output name="PPP_WOOD_SILENT" />
    </crafting>
  </recipe>

  <recipe name="Painted Pressure Plate, Stone, Silent" required="true">
    <crafting>
      <grid size="1x2">
        <item name="minecraft:stone_pressure_plate" />
        <item name="minecraft:wool" />
      </grid>
      <output name="PPP_STONE_SILENT" />
    </crafting>
  </recipe>

  <recipe name="Painted Pressure Plate, Iron Silent" required="true">
    <crafting>
      <grid size="1x2">
        <item name="minecraft:heavy_weighted_pressure_plate" />
        <item name="minecraft:wool" />
      </grid>
      <output name="PPP_IRON_SILENT" />
    </crafting>
  </recipe>

  <recipe name="Painted Pressure Plate, Gold Silent" required="true">
    <crafting>
      <grid size="1x2">
        <item name="minecraft:light_weighted_pressure_plate" />
        <item name="minecraft:wool" />
      </grid>
      <output name="PPP_GOLD_SILENT" />
    </crafting>
  </recipe>

  <recipe name="Painted Pressure Plate, Wood, Silent, Upgrade" required="true">
    <crafting upgrade="true">
      <grid size="1x2">
        <item name="PPP_WOOD" />
        <item name="minecraft:wool" />
      </grid>
      <output name="PPP_WOOD_SILENT" />
    </crafting>
  </recipe>

  <recipe name="Painted Pressure Plate, Stone, Silent, Upgrade" required="true">
    <crafting upgrade="true">
      <grid size="1x2">
        <item name="PPP_STONE" />
        <item name="minecraft:wool" />
      </grid>
      <output name="PPP_STONE_SILENT" />
    </crafting>
  </recipe>

  <recipe name="Painted Pressure Plate, Iron Silent, Upgrade" required="true">
    <crafting upgrade="true">
      <grid size="1x2">
        <item name="PPP_IRON" />
        <item name="minecraft:wool" />
      </grid>
      <output name="PPP_IRON_SILENT" />
    </crafting>
  </recipe>

  <recipe name="Painted Pressure Plate, Gold Silent, Upgrade" required="true">
    <crafting upgrade="true">
      <grid size="1x2">
        <item name="PPP_GOLD" />
        <item name="minecraft:wool" />
      </grid>
      <output name="PPP_GOLD_SILENT" />
    </crafting>
  </recipe>

  <recipe name="Painted Pressure Plate, Dark Steel Silent, Upgrade" required="true">
    <crafting upgrade="true">
      <grid size="1x2">
        <item name="PPP_DARK_STEEL" />
        <item name="minecraft:wool" />
      </grid>
      <output name="PPP_DARK_STEEL_SILENT" />
    </crafting>
  </recipe>

  <recipe name="Painted Pressure Plate, Soularium Silent, Upgrade" required="true">
    <crafting upgrade="true">
      <grid size="1x2">
        <item name="PPP_SOULARIUM" />
        <item name="minecraft:wool" />
      </grid>
      <output name="PPP_SOULARIUM_SILENT" />
    </crafting>
  </recipe>

  <recipe name="Painted Pressure Plate, Tuned Silent, Upgrade" required="true">
    <crafting upgrade="true">
      <grid size="1x2">
        <item name="PPP_TUNED" />
        <item name="minecraft:wool" />
      </grid>
      <output name="PPP_TUNED_SILENT" />
    </crafting>
  </recipe>

  <recipe name="Exit Rail" required="true">
    <crafting>
      <grid size="3x3">
        <item name="ingotIron" /><item name="minecraft:piston" /><item name="ingotIron" />
        <item name="ingotIron" /><item name="minecraft:stone_pressure_plate" /><item name="ingotIron" />
        <item name="ingotIron" /><item name="dustRedstone" /><item name="ingotIron" />
      </grid>
      <output name="enderio:block_exit_rail" amount="6" />
    </crafting>
  </recipe>

  <recipe name="Detector Block" required="true">
    <crafting>
      <grid size="3x3">
        <item name="itemChassiParts" /><item name="PPP_DARK_STEEL" /><item name="itemChassiParts" />
        <item name="itemChassiParts" /><item name="piston" /><item name="itemChassiParts" />
        <item name="itemChassiParts" /><item name="redstone_block" /><item name="itemChassiParts" />
      </grid>
      <output name="enderio:block_detector_block" />
    </crafting>
  </recipe>

  <recipe name="Detector Block, Silent" required="true">
    <crafting>
      <grid size="3x3">
        <item name="itemChassiParts" /><item name="PPP_DARK_STEEL_SILENT" /><item name="itemChassiParts" />
        <item name="itemChassiParts" /><item name="piston" /><item name="itemChassiParts" />
        <item name="itemChassiParts" /><item name="redstone_block" /><item name="itemChassiParts" />
      </grid>
      <output name="enderio:block_detector_block_silent" />
    </crafting>
  </recipe>

  <recipe name="Detector Block, Silent, Upgrade" required="true">
    <crafting upgrade="true">
      <grid size="1x2">
        <item name="enderio:block_detector_block" />
        <item name="minecraft:wool" />
      </grid>
      <output name="enderio:block_detector_block_silent" />
    </crafting>
  </recipe>

</enderio:recipes>